{
  "robots": [
    {
      "name": "robot_1",
      "namespace": "robot_1",
      "initial_pose": [1.0, 1.5, 0.21, 0.0, 0.0, 0.0],
      "goal_pose": [2.5, 1.5, 0.0],
      "odom_frame": "robot_1/odom",
      "base_frame": "robot_1/base_link"
    },
    {
      "name": "robot_2",
      "namespace": "robot_2",
      "initial_pose": [-1.0, -1.5, 0.21, 0.0, 0.0, 3.14159265359],
      "goal_pose": [-2.5, -1.5, 3.14159265359],
      "odom_frame": "robot_2/odom",
      "base_frame": "robot_2/base_link"
    }
  ],
  "map_path": "/config/map/map.yaml",
  "nav2_template_path": "/config/simulation-b3-params.template.yaml",
  "sensor": {
    "pose": [0.0, 0.0, 0.15, 0.0, 0.0, 0.0],
    "samples": 180,
    "min_angle_rad": -3.14159265359,
    "max_angle_rad": 3.14159265359,
    "min_range_m": 0.1,
    "max_range_m": 10.0,
    "resolution_m": 0.01,
    "update_rate_hz": 5.0
  },
  "room": {
    "size_m": [10.0, 10.0],
    "wall_thickness_m": 0.2,
    "wall_height_m": 1.0
  },
  "goals": {
    "xy_tolerance_m": 0.35,
    "yaw_tolerance_rad": 0.5,
    "timeout_seconds": 60.0
  },
  "check": {
    "amcl_tolerance_m": 0.4,
    "minimum_scan_messages": 10,
    "expected_scan_rate_hz": 5.0,
    "scan_rate_tolerance_hz": 1.5,
    "min_collision_distance_m": 0.6
  }
}
